{
  "$schema": "https://json-schema.org/draft/2020-12/schema",
  "type": "object",
  "additionalProperties": false,
  "required": ["schemaVersion", "status", "releaseId", "capturedAt", "passedScenarios", "sourceEvidenceSha256"],
  "properties": {
    "schemaVersion": {"const": 1},
    "status": {"enum": ["success", "failed"]},
    "releaseId": {"type": "string", "pattern": "^(?:git-[0-9a-f]{7,40}|src-[0-9a-f]{40})$"},
    "capturedAt": {"type": "string", "format": "date-time"},
    "passedScenarios": {"type": "array", "minItems": 0, "maxItems": 6, "uniqueItems": true, "items": {"enum": ["ingress", "app", "postgres", "redis", "files", "worker"]}},
    "sourceEvidenceSha256": {"type": "string", "pattern": "^[0-9a-f]{64}$"}
  }
}
