{
  "capturedAt": "2026-07-29T19:41:59.096445Z",
  "passedScenarios": [
    "ingress",
    "app",
    "postgres",
    "redis",
    "files",
    "worker"
  ],
  "releaseId": "src-bdf19804cf29d19634b131a16d3e519d26f0d425",
  "schemaVersion": 1,
  "sourceEvidenceSha256": "4ed60da73a7c23f962932366bb590686ad25769bc6de040209840e6aa4d68a93",
  "status": "success"
}
